,work_id,user_id,title,rating,summary,language,words,comments,kudos,bookmarks,hits,completed,chapters_written,chapters_total,datetime_updated
428,work_19827700,user-35202,In Their Own Secret Tongues He Spoke,Teen And Up Audiences,"The second half of goblin-raised Harry’s first year and the first half of his second year at Hogwarts, where he finds even more people, things, and animals to talk to, and manages to gently correct some people’s mistakes.",English,10636,206,8030,450,58731,True,2,2,2019-07-17
429,work_12693843,user-148079,The Claiming of Grimmauld Place,Explicit,"When Grimmauld Place begins fighting against Harry’s ownership of it, he decides he needs help to train the historic home — but little does he expect that it’ll be Malfoy who’s most suitable for the challenge. However, as Malfoy and Harry get closer, Harry comes to understand that expectations aren’t always the best path by which to guide his heart — and in the process learns just what is needed to make a house a home.",English,74228,989,8030,2746,125536,True,7,7,2017-12-02
430,work_833733,user-248160,Something I Don't Want to Stop,Explicit,"It's Harry and Draco's eighth year, the Houses have been all but demolished in favor of unity, and they're being forced to room together. How ever will they cope?",English,16228,119,8026,1404,152492,True,1,1,2013-06-07
431,work_7249360,user-90319,The Earl,General Audiences,It only takes Draco a few seconds to realize the bit of fuzz has yellow eyes and is very much alive.,English,3170,185,8015,683,61388,True,1,1,2016-06-20
432,work_12749823,user-2610256,For The Greater Good,Mature,"
  When Harry and Draco discover they’ve been bonded to one another, neither one of them is prepared for the secrets they slowly begin to uncover.
",English,59246,769,8012,2185,117158,True,9,9,2017-12-05
433,work_21166118,user-264155,Not Just Pretty Words,General Audiences,"Pre-Canon AU: On an unexpected holiday to America, Harry Potter meets a strange girl at a zoo, finds out that he's a witch, steals a snake, and is cordially invited to the Addams mansion for dinner.",English,22313,343,8008,2394,64645,True,1,1,2019-10-25
434,work_10313534,user-46568,Roar,Teen And Up Audiences,After Graves' fourth escape attempt Grindelwald decides that turning the man into a magical creature -  a process thought to be impossible to reverse - will take care of the problem quite nicely. Too bad he didn't anticipate Newt Scamander.,English,62484,1234,7999,2120,107403,True,10,10,2017-05-31
435,work_3502418,user-223228,Moments in Time,Explicit,"Tom Riddle thought he was dreaming the first time, but when he repeatedly visits the same boy, he realizes that bigger things are at work. He watches the boy in the cupboard grow from a small child and into a young man. His brotherly affections begin to wane. What will he do when the boy isn't so little anymore? Could he even imagine? Those Avada eyes calling to him.",English,47027,464,7987,1899,163663,True,20,20,2015-03-26
436,work_12391806,user-114300,where there's a will,Teen And Up Audiences,Harry writes the first draft of his will when he’s fourteen.,English,7853,358,7983,2823,54321,True,1,1,2017-10-17
437,work_38231509,user-8,Heal Thyself,Teen And Up Audiences,"""Are you going for the course?"" Lovegood asked. ""You have the NEWTs.”",English,46905,739,7981,2827,76580,True,1,1,2022-04-07
438,work_11796285,user-4316,Waiting By An Open Door,Explicit,"Draco starts following Potterwatch secretly during the War. He wishes Potter would come save him too. But that sort of thing only happens in fairy tales, and Malfoys don't get fairy tale endings, do they?",English,29506,203,7972,2057,103266,True,1,1,2017-08-13
439,work_22414333,user-158230,"But For You, I Did",Mature,"When 11-year-old Tom Riddle finally arrives at Platform 9 and ¾, he meets fifth-year Prefect Harry Evans, a Muggleborn Slytherin at the top of his year. Harry is everything that Tom wants to be—Harry knows exactly what it’s like to be special, intelligent, and have no one understand you… ",English,20976,396,7970,1979,75490,True,1,1,2020-01-26
440,work_6168172,user-2653,Aftershocks,Explicit,Harry’s favourite time to finger Draco is right after sex.,English,1447,72,7969,838,156045,True,1,1,2016-03-05
441,work_27799261,user-8972152,How Fate Intended,Explicit,"The tattered memory of Tom Riddle sat on the porch of number four Privet Drive, pressing desperately into the horcrux housed in Harry Potter’s forehead. ",English,399016,3802,7967,2052,388284,True,72,72,2021-03-12
442,work_15967970,user-3246312,"Dear Cousin, Love Regulus",Mature,"As the sole Malfoy heir, Draco understood that his path was set long before his birth; who to be, how to act and what his choices should be. What he had not counted on was the power of outside influences. Letters from his deceased cousin caused him to realize that he did have choices, starting with the choice to be someone else, to be who he wanted to be. The road to self-discovery was difficult and navigating that path in the shadow of Harry Potter was its own challenge but maybe, just maybe, his friends would help him along the way. And he would owe it all to Regulus Black.",English,86569,791,7947,2555,110313,True,7,7,2018-09-15
443,work_15384810,user-4360965,Take Into the Air (My Quiet Breath),Teen And Up Audiences,"Draco is dying of Hanahaki Disease. Serves him right, Harry thinks.",English,11725,357,7932,1517,63570,True,1,1,2018-07-24
444,work_16731783,user-192660,Guess Who's Coming to Dinner,General Audiences,Harry's bringing his boyfriend home to meet his parents. It goes about as well as can be expected.,English,5098,148,7906,1197,57938,True,1,1,2018-11-25
445,work_22065178,user-3861138,Do Not Go Gentle,Explicit,"It was subtle at first. For the first several months, she assumed it was merely the stress of the war; for the next several months, she assumed it was the stress of the trials; then when winter approached, she assumed it was stress from school. ",English,34435,1163,7881,1797,114042,True,10,10,2020-03-02
446,work_24732352,user-3904908,Welcome To Earth,Teen And Up Audiences,"It was all gone.Magic was gone.Harry didn't know what world this was, but he knew it wasn't his own.He was alone.---------------Harry Potter wakes up in an alley in New York City to a world vastly different than the one he knows. Apparently superheroes exist, and his new neighbour might be one of them.",English,69442,1063,7874,2515,186439,False,16,,2022-05-09
447,work_12752880,user-3022026,Back to You,Teen And Up Audiences,"The eighth years make Harry and Malfoy go head to head and back to back in a question-and-answer drinking game. The worst that can happen is they end up drunk, right?",English,8565,282,7853,1325,53910,True,1,1,2017-11-17
448,work_8132777,user-187043,To Be Set Free,Teen And Up Audiences,"Harry Potter, raised and abused by the Dursleys ever since his parents died, lives in the cupboard under the stairs. He has no friends or family who love him and his life is dull until one day a letter arrives arrives for him, written in green ink, that promises freedom. Sounds familiar, right? ",English,35831,740,7847,1793,97892,True,14,14,2016-12-25
449,work_16689439,user-3715869,How 'Potter' became 'Harry' because of a Seeker's game,General Audiences,"Post-War, Hogwarts Eighth Year Soulmate AU where an animal that identifies your soulmate appears somewhere on your body. Draco's is a stag, and he's been lying to everyone and saying it's a snake because he knows no one would approve of a former death eater being Harry Potter's soulmate. ",English,1644,105,7825,625,64894,True,1,1,2018-11-21
450,work_13182756,user-148079,The Romantic Prawn Who Loved Christmas,Explicit,"When Draco, forced into sharing a room with Potter for the year, finds out that Potter has a sleepwalking problem, he expects the odd conversations and the weird games of chess.",English,39404,437,7820,1931,104353,True,2,2,2017-12-28
451,work_6332662,user-1343168,Who I Really Am,Explicit,"Draco seems to have changed since the war, and is insisting on making amends for his actions. But he's still a Malfoy, for heaven's sake... And, it would seem, a Malfoy with a certain kink...",English,8541,78,7819,856,90835,True,1,1,2016-03-23
452,work_3542057,user-1020920,Children of the Revolution,Mature,"AU. In a world where Sybil Trelawney is never born, the prophecy remains, but goes unheard. How different will Harry Potter's life be, growing up in a world where Voldemort won? How long until a brilliant young man is noticed by the ever more brilliant Dark Lord?",English,171998,1217,7815,2459,204402,False,34,,2022-08-31
453,work_20485358,user-3259101,"familiar faces, worn out places",Explicit,"“You are at St. Mungo’s. You were in a coma.” He looks me over again, taking a pause. “I am a Healer here now,” he says, like it explains something. My fingers stretch, drifting across his sleeve. He looks down, like I’ve thrown mud at him. ",English,7386,286,7801,1485,93403,True,1,1,2019-09-02
454,work_28230387,user-203828,The Mountains Eat the Stars,General Audiences,Post-Running on Air. Domestic fluff and Christmas with the family.,English,4894,482,7785,927,47193,True,1,1,2020-12-22
455,work_8572348,user-211835,Lift Your Open Hand,Mature,"With Draco Malfoy as his assigned partner for the next six weeks of Auror training, Harry had been prepared for things to go poorly. But getting themselves accidentally bonded to each other in the first twenty minutes of their very first assignment seemed going above and beyond, even for them.",English,18752,322,7784,1458,94813,True,1,1,2016-12-27
456,work_11030553,user-1221814,Harry's Years,Not Rated,What if things didn't go the way Dumbledore had hoped at the Dursley residence?,English,25409,815,7759,1470,148432,True,12,12,2018-05-06
457,work_25634758,user-6757519,Beginning and End,Explicit,"Years. Broken into months into weeks into days—into hours, minutes, seconds—into moments. Simple at one end, complex at the other. In Draco’s experience, moments, even when simple, had a habit of becoming irretrievable. Moments grew, stretched, multiplied into ages and eras that defined whole stretches of measurable time. Draco regretted several moments in his life, some within his control, some without: all of them irretrievable in nature. At a certain point, wedged between ‘what-ifs’ of his own devising, he’d stopped trying to keep track of those regrettable moments: now and then, pushing and pulling, coming and going, beginning and end. Moments were only moments for just as long. After that, he had no control.",English,241977,3752,7746,2132,432418,True,48,48,2020-12-26
458,work_15275916,user-114300,"there will come a time, you'll see",Teen And Up Audiences,They have Shepard’s pie for dinner. Ron and Hermione watch Harry fill up his plate and only start serving themselves when he picks up his fork and starts eating. Neville laughs into his wine glass.,English,10773,238,7714,2422,60572,True,1,1,2018-07-13
459,work_12272349,user-2563906,An Unexpected Malfoy,Mature,Once upon a time Hermione Granger literally ran into Draco Malfoy in a bookshop. His mother sees a connection between her son and the muggleborn that she can't ignore and determines to get to know the girl. An imagining of how things could have gone if Hermione had been taken under the wing of the Malfoy family.,English,283953,2009,7714,2629,350931,False,60,,2022-10-19
460,work_11750064,user-2693,Beastspeaker,Teen And Up Audiences,or: Five times Graves talked to a magical creature and one time he told someone he could.,English,17623,197,7714,1962,59034,True,1,1,2017-08-09
461,work_10514262,user-148079,Play Dates,Explicit,Harry never thought seeing Malfoy as a dad would affect him this way.,English,7722,262,7713,1278,87967,True,1,1,2017-04-01
462,work_6361297,user-1221814,Fixing It,Not Rated,What happens when abuse goes to far? How does Severus and Tom become Harry's family with the Malfoy and Poppy helping?,English,39952,814,7713,1837,232298,True,19,19,2020-07-30
463,work_8001085,user-16139,Soulmate Drabbles,Mature,A collection of drabbles written for soulmate!AU prompts on Tumblr.,English,26104,859,7700,821,118731,True,46,46,2017-02-04
464,work_16104623,user-4329900,Eternal Hilarity,Mature,"Harry Potter, Master of Death, was reborn fifty-one times with his soulmate Tom Riddle in various eras and universes. They finally returned to their first life after a millennia of absurdity and amusement, and Harry's ready to make the most of it.",English,56791,2578,7696,2228,165475,False,20,,2020-06-21
465,work_857495,user-147372,A Piercing Comfort,Teen And Up Audiences,"When Harry Potter hits the lowest point of his life so far, it is not his friends who keep him honest. With Draco Malfoy's patience and guidance, Harry learns to stand on his own. The thing is, after the fact—he's no longer sure he wants to.",English,44566,311,7690,2442,167378,True,1,1,2013-06-25
466,work_13079685,user-71159,"You cannot save people, you can only love them",Explicit,"Upon returning for Eighth Year, there are so many strange things going on with Malfoy, Harry doesn’t know where to start. He won’t talk to Harry, but he’s talking to ghosts. He won’t apologize for his past, but the Black Family tapestry has crossed him off its tree. And the worst of it all, he still has that infuriating, snotty mouth on him that gets Harry’s dick hard as a rock drives Harry insane.",English,51732,492,7672,1790,129805,True,9,9,2017-12-27
467,work_28711803,user-8714605,Carpe Noctem,Mature,"Golden boy,Lion boy;Tell me what it’s like to conquer.",English,449380,2167,7666,2059,378743,False,37,,2022-04-23
468,work_7892593,user-1851754,HP & The Philosopher's Stone: The Time Jump Chronicles,Mature,"Harry Potter, The Boy Who Lived to Defeat Voldemort, Head Auror of the MLE, finds himself stuck in his 11-year-old body after a potions accident. How does 28-year-old Harry deal with being a First Year, with Voldemort rising back to power, and himself a Horcrux again? How does being sorted into Slytherin affect his relationship this time around with Snape? EWE. Slash.",English,91132,1540,7665,1449,168198,True,29,29,2018-12-26
469,work_1008166,user-215966,A New Place To Stay,General Audiences,"Harry Potter is called up to Dumbledore's office and told he was being moved elsewhere to keep him safe. He no longer has to stay at the Dursley's, but Dumbledore tells him he has to stay with Severus Snape. For a few days it seemed like a bad idea. Until Severus Snape uncovers the truth of who Harry Potter really is and what he's been through. Watch as Severus does as nobody else has done before him. He takes care of Harry. Watch him flourish into who he was meant to be, a boy with the heart of a Gryffindor and smarts of a Slytherin. The Dursley's, Umbridge and Dumbledore had better watch out Severus is out for revenge. Spy or no spy, Severus is not allowing anyone away with hurting Harry.",English,344130,1310,7656,2571,290990,True,79,79,2015-04-12
470,work_17175614,user-2680,Star Quality,Explicit,"Two years after the war, and Harry’s content with his life. OK, so it’s a little annoying that he keeps winning Witch Weekly’s Most Eligible Bachelor award, and he’s really not looking forward to the unveiling of an enormous gold statue of himself, but he loves his friends, and he loves being an Auror. And if he yearns for something more, something he can barely bring himself to think about, well, he’ll probably get over it. No one’s happy all the time, are they?",English,118607,977,7640,2132,129864,True,15,15,2018-12-31
471,work_189189,user-9901,The Changeling,Teen And Up Audiences,Ginny is sorted into Slytherin. It takes her seven years to figure out why.,English,182687,1703,7635,3888,219388,True,11,11,2017-04-19
472,work_9395963,user-93265,Prized,Mature,"Severus Snape's loyalty has always been to Harry, not to Dumbledore or the Order. When he finds out that Harry is a horcrux and Dumbledore intends to have him killed, Severus goes to the Dark Lord with the information in an effort to save Harry's life, and in doing so changes the fate of the world.",English,120217,1186,7628,1987,190526,True,49,49,2018-07-18
473,work_1024956,user-215966,Invisible,Mature,"On that faithful Halloween night Nick Potter was hailed 'Boy Who Lived' his twin Harry was ignored in favour of the favoured famous son. Harry is pushed aside, when it comes to it what will happen? will Harry fight for a world that didnt want him or care about him? will Dumbledore, the Potter's and world grovell at his feet praying he will save them? Snarry/slash. What happens when the world finds out he was the one to survive that faithful halloween night? oh so many years ago?",English,581088,1049,7609,2260,378421,True,112,112,2016-06-13
474,work_19771492,user-1750174,knickers in a twist,Explicit,Draco loses a bet to Pansy and Blaise which leaves him wearing a skirt for a whole week. Harry discovers something about himself.,English,86461,534,7591,1981,197928,True,7,7,2020-02-29
475,work_12510092,user-2736428,As Time Passes,Mature,"It wasn’t until Harry was six that he felt his hand start to burn and he knew that the Dursleys had lied to him! The unbearable pain was the sign of a soulmate bond forming. Harry grows up imagining everything about his soulmate, who would they be and what kind of person they were. Just who was Draco Malfoy?",English,32816,426,7588,1200,109103,True,3,3,2018-01-09
476,work_3133712,user-51846,Open For Repairs,Mature,"After the war, Draco works at a tv repair shop and Harry breaks things.",English,34901,580,7588,2314,97720,True,1,1,2015-01-07
477,work_8850352,user-946070,Storm of Yesterday,Explicit,"Hunted by Voldemort, Hermione and Harry make a last stand in Godric's Hollow. When the Boy-Who-Lived lives no more, Hermione is thrown back in time into another battle where she has a chance to save not only Harry, but another Potter. — Begins Mid Deathly Hallows, AU going forward.",English,129507,1510,7578,2326,158031,True,68,68,2017-01-31
478,work_500970,user-7388,"Hope Springs Eternal (But Love Springs in the Forest, Unannounced)",Explicit,Draco falls into a love spring.  Harry saves him!  And now they’re bonded for life.  Draco is horrified.  Harry thinks it’s kind of neat.,English,12394,162,7576,1377,130371,True,1,1,2012-08-31
479,work_2135742,user-36738,Once a Fool,Explicit,"Harry always held the hope that Draco would come back, and now he had, just not in the way Harry would’ve imagined. Draco had clearly moved on, judging by the three year old clutched to his legs.",English,7309,71,7574,938,102544,True,1,1,2014-08-14
480,work_384445,user-35571,SCHOOLED,Explicit,"7th Year Gryffindors learn why it is never a good idea to piss off Ravenclaw Hadrian Morgan. His payback during Professor Slytherin's class is BEAUTIFUL. In carrying it out, orphaned pureblood Hadrian catches the interest and libido of the present Lord Marvolo Slytherin, who -- with the assistance of the entire Slytherin student body as well as a few other surprising characters -- tries to lure Morgan into his life and his bed. But just how naive is Hadrian Morgan, really?1945-era mash-up of most major and minor characters of HP and other fandoms, as well as historical characters. [WAIT, PLEASE! .... ahem.... If you just heard a mental screech of brakes, please understand that this is not a farce, nor crack, nor crap.  This has many reviews from now-devoted readers who almost bypassed it, but are now glad they accepted the dare to just try chapter one.]",English,113681,1329,7563,3481,237589,False,17,,2013-04-25
481,work_2350745,user-45020,Scorpius Malfoy's Future Wife,Teen And Up Audiences,"Albus Potter and Rose Weasley's parents have a bet on who Scorpius Malfoy is going to marry. If it's Lily, they will be just like Ginny and Harry; If it is Rose, they'll be just like Ron and Hermione. Harry witnesses the answer.",English,1802,169,7553,546,62709,True,1,1,2014-09-23
482,work_4989265,user-1557508,We Were Infinite,Mature,"“The Marauders aren’t something that will just go away once we graduate.” James continued, taking a more serious tone and addressing not only Remus, but the fear that they all had found recently in the back of their minds about what may become of them outside the walls of Hogwarts. “We’re a family. We’ve proven that again and again, haven’t we? We’re forever. Unstoppable. We’re infinite.”",English,341962,3272,7540,1735,272067,False,107,,2021-03-08
483,work_21277262,user-35202,Leon Potter,Teen And Up Audiences,"The moment that Harry’s name comes out of the Goblet of Fire, a stranger appears—a Potter relative that Harry never knew he had. The stranger stands up for Harry, adopts him, and makes sure that no one can touch him. It’s only later that Harry knows why.",English,9229,156,7539,1422,57929,True,2,2,2019-11-03
484,work_27475108,user-51893,Independent Study,Mature,"Dumbledore doesn't make it in time for Harry's trial, and the outcome is very different. Harry is expelled, his wand snapped.",English,144148,1163,7538,2800,157217,True,35,35,2020-12-24
485,work_630702,user-31607,A Short Summary of Things That Are James Potter's Fault,Teen And Up Audiences,"In which the mistletoe is hexed, Remus would rather not spend the night in a broom cupboard, and several things are James Potter's fault.",English,2205,46,7536,755,75446,True,1,1,2013-01-08
486,work_13232688,user-186850,Rewriting Destiny,General Audiences,"They all thought after Voldemort's fall that the world would get better. But they were wrong. The Death Eaters used politics to accomplish what Voldemort never could. And with the dwindling Wizarding population and no one left to fight, there's only one solution: to go back in time to before Voldemort rose to power, and fix what broke the first time around. Time Travel AU. Nominated for Best James Potter and Best Peter Pettigrew in the 2018 Marauder Medals!",English,318188,1453,7528,2581,298353,True,76,76,2019-02-24
487,work_21325375,user-4578719,The Farland Files,Teen And Up Audiences,"Lord Voldemort stared at the cradle, blinking slowly in a way that some would compare to a reptile. There was not one, but two children where he had only been expecting one. Staring down at them, he lost his snake-like glamour and leaned forward. “Which one of you… is my supposed death?”",English,263822,2630,7522,2261,254509,True,68,68,2021-10-26
488,work_15676317,user-4395618,When Harry Met Tom,Teen And Up Audiences,"When the battle in the department of mysteries heads south, Harry finds herself flung backwards in time to 1942, where Tom Riddle is a prefect in his fifth year. Armed with this knowledge, but little else, Harry desperately tries to find a way home and for once in her life not screw it up. Tom, for his own part, wonders when Harry Evans will head back to the mothership.",English,182921,1883,7518,2083,223177,False,33,,2022-06-24
489,work_8976520,user-8719,A Bit of Bother and All That,Explicit,"Despite later claims by Porpentina Goldstein, the first thing that Newt Scamander, illegal magizoologist, actually said to Graves was “Oh. I really didn’t think that there were two of those.” ",English,9248,195,7509,1500,79339,True,3,3,2016-12-23
490,work_311126,user-4650,Second Life,Explicit,"Hermione is forced to lead a double life when she agrees to Dumbledore's plan to protect Professor Snape. Follows a (mostly) canonical timeline through books 6 and 7. Warning for student/teacher relationship, though Hermione is of age.",English,231591,810,7502,2039,223507,True,48,48,2008-09-03
491,work_23296162,user-49752,The Disappearances of Draco Malfoy,Mature,"The night that Harry and Dumbledore return from the cave, the Death Eaters are delayed from reaching the top of the Astronomy Tower for one more minute. Draco Malfoy lowers his wand.",English,295528,2902,7500,3626,417568,True,33,33,2021-06-18
492,work_10668402,user-1838662,Cupboards and Cryogenics,Teen And Up Audiences,"When HYDRA sends The Winter Soldier to bring them the four-year-old Boy Who Lived, the outcome is not what they expected.",English,202669,3696,7499,2422,256028,False,73,,2022-10-31
493,work_25918393,user-220929,Draco Malfoy and the Wheel of Hecate,Teen And Up Audiences,"Whatever Draco does in the past, it seems he is unable to change much for the better. But he hasn't given up trying, and in the year where Voldemort rises again, he will stop at nothing to ensure he prevents it, leading him down a dangerous path. Standing in his way is not only the force of evil and the force of destiny, but the force of his own indecision, as he finds he can no longer share his secrets with his godfather, nor can he protect his beloved cousin Luna- and nor can he keep his feelings for Harry a secret any longer either. For better or for worse, the reckoning has come.",English,172692,2370,7481,491,179142,True,24,24,2020-09-30
494,work_23572426,user-6646402,One Quiet Question,Not Rated,Growing Up Harry learned many lessons for life such as being quiet is the best way to avoid trouble and don't ask any questions.  What happens if during his first trip to Gringotts he goes against both of those lessons?,English,136795,821,7480,2385,338555,True,36,36,2021-10-14
495,work_7044232,user-211835,You Were Crushed (Just Like Me),Explicit,"Something finally comes of Harry's embarrassing crush on Malfoy. (Well, two somethings. Someones. Whatever. Also all of Harry's friends are terrible.)",English,4964,223,7478,870,78846,True,1,1,2016-05-31
496,work_24688096,user-61654,we who walk in shadows black,Mature,"The boy looks up, eyes like the killing curse framed by soot-black lashes, and smiles. It’s a cold, wicked thing with far too many teeth to be friendly and far from the attitude Dumbledore is likely expecting. ",English,3509,114,7477,1712,54731,True,2,2,2020-08-06
