,work_id,user_id,title,rating,summary,language,words,comments,kudos,bookmarks,hits,completed,chapters_written,chapters_total,datetime_updated
213,work_14755667,user-1650347,Scent and Sensibility,Explicit,"“I don’t care if Potter likes me,” Draco sniffed, coming to terms with his mother’s betrayal, both of his hand in marriage – or mating – and her trust in his likeability. Old lady was obviously losing it. He was adorable.",English,7503,104,11438,1561,141907,True,1,1,2018-05-26
214,work_22365040,user-4729745,"he's a killer queen, sunflower, guillotine",Teen And Up Audiences,"He has to be the weirdest Hufflepuff Harry’s ever seen.Scratch that, he’s the weirdest Hufflepuff Hogwarts has ever seen.",English,218412,3515,11409,3529,348904,False,28,,2022-03-13
215,work_15766221,user-3861138,The Seduction,Explicit,"“Hermione,” he said in a strained voice, ”please don’t take offense by how blunt I’m about to be, but I’m honestly afraid that if I explain this with any type of subtlety it will somehow continue to elude you.”",English,11686,271,11343,2448,182699,True,1,1,2018-08-22
216,work_242815,user-17087,Amateur Cartography,Teen And Up Audiences,"That one-night stand with Draco Malfoy was a mistake. Hermione doesn't make mistakes, or at least she isn't supposed to. She's working hard at her Ministry career, however frustrating and pointless her job may be, and she's also got to live up to everyone's expectations as Hogwarts's most famous Muggle-born and a top-tier War Hero. So, why is she still sleeping with Draco Malfoy, ex-Death Eater and infamous pureblood? And why isn't she certain that she wants to stop?",English,20995,257,11336,2353,188837,True,1,1,2011-08-21
217,work_13990401,user-2878526,Dress up in You,Mature,Non-magical modern AU - Marauders/Wolfstar,English,88408,1044,11323,2485,237595,True,19,19,2019-07-18
218,work_28023093,user-35202,Pythonicus,Teen And Up Audiences,"Sequel to “Princeps” and “Potens.” Harry has gained the loyalty of many of the young Slytherins, and others he never expected. Now he attempts to find and destroy Voldemort’s Horcruxes and protect and teach his students while avoiding Time’s plans—and his followers’—to make him into a Lord.",English,44388,905,11310,1143,86829,True,7,7,2020-12-18
219,work_11277078,user-148079,You And Me,Explicit,"When Harry sits down with Malfoy, he's really only looking for a reprieve from the constant stares and whispers. (Mostly.)  What he gets instead are a series of strange events that lead to a friendship that is something else, questions that nobody knows how to answer, and the realisation that the person that Harry doesn't know how to hate, anymore, seems to be the person who knows exactly what he needs.",English,27619,474,11292,2514,175526,True,1,1,2017-06-23
220,work_717901,user-50188,"Coffee, Cakes and Doorknob Snakes",Explicit,"Harry's house is trying to kill him, and only one person can help him: pity it's Draco Malfoy",English,40842,209,11254,2847,172764,True,1,1,2013-03-12
221,work_15432591,user-35202,Shadow Magic,Mature,"AU. Harry was born with a power the Dark Lord knows not: the magic to see into shadows, to walk the shadows, and to send the shadows everywhere. This changes his life rather dramatically.",English,48243,663,11217,2582,155434,True,7,7,2018-08-01
222,work_6996898,user-1199785,Snapped,Teen And Up Audiences,"“Scared Potter?” Malfoy sneered, and Harry snapped. He was done, finished, fed up with playing the innocent little Gryffindor with no common sense and a microscopic amount of intelligence. He rolled his eyes.",English,19478,1093,11186,2335,238170,True,13,13,2017-01-16
223,work_23872387,user-220929,Draco Malfoy and the Mirror of Ecidyrue,Teen And Up Audiences,"All it takes is one look in a mirror and an ill-advised attempt to shatter it, before an embittered Draco Malfoy fresh out of Azkaban is sent back into his body on the day he gets his Hogwarts letter.",English,90081,1075,11134,1629,245481,True,18,18,2020-05-31
224,work_7609768,user-8,Erosmancy,Mature,"Blaise was immune to whatever it was people usually felt around his mother, for which he was profoundly grateful, since no one needed an Oedipal complex on quite that spectacular a scale, but that didn’t mean he didn’t have a thorough respect for her gift.",English,11057,315,11094,1849,132422,True,1,1,2016-07-28
225,work_8181095,user-223228,Strive,Mature,Tom Riddle finds that he does not like it when Professor Potter doesn't pay him any attention. Something should be done about that.,English,42833,1178,11091,2905,209617,False,23,,2020-01-04
226,work_8274067,user-264155,Or the Look Or the Words,General Audiences,"Goblet of Fire AU: The change in their relationship happened during fourth year, when an exhausted and dateless Harry groaned out the important question of, “Why can’t we just go together?”",English,6401,387,11082,2723,99126,True,1,1,2016-10-13
227,work_5403371,user-191264,Any Instrument,Explicit,Draco Malfoy wouldn't go back to England for anything less than an exceptional case. Being asked to figure out why Harry Potter can't control his magic might be exceptional enough to qualify.,English,131102,954,11080,3554,243268,True,22,22,2015-12-19
228,work_8676250,user-244546,The Cigarette Case,General Audiences,Apparently even Gellert Grindelwald isn't immune to a niffler's sticky paws. ,English,6764,453,11053,2406,84310,True,4,4,2016-12-12
229,work_13978644,user-3399492,Resurrect The Living,Mature,Circumstance makes Harry an offer he can't refuse.,English,97395,2842,10933,4377,241525,False,35,,2022-06-26
230,work_14452923,user-3259101,All the Wrong Things,Explicit,"Sequel to ""The Right Thing to Do"" - Draco's POV. Part 2 of the ""Rights and Wrongs"" series.",English,160297,2321,10894,2549,533579,True,24,24,2019-04-14
231,work_11457669,user-287005,a life of smoke and silvered glass,General Audiences,"Albus Dumbledore rose to his feet, smiling at them in that way of his, like he knew something you didn't and he was proud of you for it. ""Friends,"" he began.",English,27794,1060,10878,2683,135937,True,1,1,2017-07-10
232,work_8651560,user-613218,To Build a Home,Explicit,"Newt Scamander's mark is in the form of a panther, wild and ferocious, the black ink running elegantly down his wand arm and ending with the thick tail wrapped possessively around his wrist. ",English,43390,1760,10836,2426,163917,False,18,22,2018-11-19
233,work_9181330,user-46568,Attachment Issues,Teen And Up Audiences,"Five times one of Newt’s creatures hitched a ride to work with Graves, and one time he took them along on purpose.",English,15234,631,10825,3007,110560,True,6,6,2017-01-27
234,work_6762790,user-165575,Future's Past,Explicit,"Her godfather is dead. So is Tom Riddle, which appears to be the only thing  anyone else cares about. Oh, and getting ahold of her, her money, and her titles. Fuck that noise. Ianthe learned how to Maraud from the best, and she doesn't intend to take this lying down.",English,40945,774,10824,4087,232477,True,15,15,2016-05-07
235,work_3909259,user-128027,Bad Medicine,Explicit,"As an Auror, Harry is no stranger to St. Mungo's Hospital for Magical Maladies and Injuries but he has reached his limit with his confidential information appearing in the Prophet after every visit. He's angry enough to give even his childhood nemesis's private practice a go. At least if Harry's secrets show up in the paper now, he'll know who to hex.",English,25257,861,10716,2127,156951,True,15,15,2015-06-20
236,work_6334630,user-1731808,The Sum of Their Parts,Mature,"For Teddy Lupin, Harry Potter would become a Dark Lord. For Teddy Lupin, Harry Potter would take down the Ministry or die trying. He should have known that Hermione and Ron wouldn't let him do it alone.",English,138205,1372,10711,5532,190879,True,11,11,2016-04-12
237,work_388303,user-6004,The Ties That Bind Us,Explicit,An accident leaves Draco and Harry bound tightly together. Literally.,English,27890,153,10688,1929,211011,True,1,1,2012-04-21
238,work_6832576,user-18623,The Dragon of Moria,General Audiences,"After the Battle of Hogwarts, Harry Potter helped with the rebuilding and then went back to school, sitting his NEWTS and graduating with the rest of what The Daily Prophet called ‘The Disrupted Class.’ Following that, everyone expected him to become an auror. Harry himself expected it, right up until the moment came to apply to the academy.",English,5200,356,10680,2496,105273,True,1,1,2016-05-12
239,work_8184311,user-2708833,Secrets,Explicit,"Beginning with Draco's unexpected arrival at the Dursleys, Harry's summer after sixth year becomes filled with activity and many secrets.  As his summer progresses, Harry generates several unexpected allies as he finds himself actively becoming the leader of the Light side.  H/D post-HBP ~~Complete~~",English,395365,1158,10556,4461,428478,True,62,62,2006-06-02
240,work_23548960,user-326242,"It's A Masquerade, Darling",Mature,"An orphan, Harry Potter has done everything he can to avoid notice during his five years at Hogwarts so far. He’s only got one friend, is purposefully in the middle of his class rankings, and his only ambition, wizarding-wise, is to graduate with enough N.E.W.T.s to get a loan and open up a bookstore.",English,53980,1862,10544,3730,177456,False,22,,2021-12-30
241,work_24931486,user-35202,Forget-Me-Not,Mature,"Harry isn’t the Boy-Who-Lived, but his parents still died, and Albus Dumbledore, concerned that Death Eaters might seek the boy’s death, cast a powerful charm on him to make wizards ignore him before Harry was left with the Dursleys. Except, with the Elder Wand in play, the charm was far too powerful, and made others essentially forget Harry existed when not directly interacting with him. Sorted into Ravenclaw at Hogwarts, Harry lives a contented life with no one either loving or hating him…until the charm breaks on his seventeenth birthday, and he’s suddenly plunged directly into the middle of a living world at war.",English,50776,635,10501,3493,107085,True,7,7,2020-07-03
242,work_19296382,user-4211001,It's All Just Temporary with a Bit of Necromancy,Teen And Up Audiences,"Harry gets his magical inheritance as a Necromancer on his 16th birthday, the first in centuries. Unsure of his future or even who to trust after the Light shuns him, Harry turns to the Dark, the only other side that can assist him in seeking his revenge. However, it's all just temporary. It's just an alliance until his goals are met and then that's it. Just temporary...right?Slight Dumbledore and some Order member bashing. Sane Voldemort but Horcruxes do exist. A Harry/Voldemort but incredibly slow-burn. Not really graphic in deaths at least not yet. If that changes the rating will change.",English,285255,1672,10496,3496,400310,False,43,,2022-11-19
243,work_26362207,user-223039,To Live Is The Rarest Thing,Explicit,"A disastrous trip to a waterpark (thanks, Dudley!) unleashes almost 200 lifetimes worth of memories, and now Harry is stuck as a ten-year-old while his soulmate is a wraith set on killing him.",English,135248,1907,10452,3347,304562,False,24,,2022-09-15
244,work_879599,user-104018,Reparations,Explicit,"Harry is about to discover that the steepest learning curve comes after Healer training, and that second chances can be found in unexpected places.",English,87376,651,10438,3228,256433,True,10,10,2013-07-11
245,work_7693897,user-700856,Life skills outside the curriculum,Explicit,"It was ""Witch Weekly"", of all people and organizations, the first to notice and comment on The Boy Who Lived’s absence from the ranks of first years at Hogwarts. The magazine went on to elucubrate that the young hero was studying at a foreign school, possibly Beauxbatons or Holzschuhkäse.",English,66238,2124,10413,3506,128896,True,11,11,2016-09-17
246,work_3697037,user-57438,Unexpected Consequences,Explicit,"Harry was going back to school. He was going to play Quidditch, sleep in lessons, hang out with his friends, and generally just enjoy being a kid for a change. And he was also going to do it while being bonded with Malfoy, because apparently life was just going to continue throwing curveballs at him. Harry didn't know why he expected anything different.",English,39192,440,10397,2031,172282,True,7,7,2015-04-12
247,work_24974563,user-3861138,Height,Explicit,“Tall? That’s what you think I should notice about Malfoy? His height?”,English,8777,253,10380,2215,153950,True,1,1,2020-07-01
248,work_16856581,user-35202,Music Beneath the Mountains,Teen And Up Audiences,Little Harry Potter wanders away from the Dursleys’ home one day and is found by a goblin on a mission from Gringotts. Harry grows up in the goblin deeps.,English,7324,443,10359,1295,86916,True,2,2,2018-12-06
249,work_13076754,user-2680,The Sleeping Beauty Curse,Explicit,"When Draco Malfoy falls into a cursed sleep and can only be woken – at least, according to the Daily Prophet, that impeccable source of truth – by ‘true love’s kiss’, Harry Potter knows there’s no way on earth he’s the answer to this particular riddle. Is he . . .?",English,152548,1368,10354,2874,227369,True,23,23,2017-12-23
250,work_453655,user-9,5 times Crowley was Summoned on purpose + 1,General Audiences,"Crowley had no idea who'd let slip how to summon demons, but it was a damn pain in the arse sometimes.Recently, however, things had just been getting ridiculous.",English,10049,220,10321,1598,113785,True,6,6,2013-01-07
251,work_542089,user-69140,Good Company,Teen And Up Audiences,"With Hermione and Ron always together, Harry's return to Hogwarts to complete his education isn't exactly fun. Somehow, it's his unlikely friendship with Malfoy that keeps him sane.",English,8223,136,10313,1730,85182,True,1,1,2012-10-21
252,work_12922518,user-4316,Things Worth Knowing,Explicit,"After the Battle, Harry thinks he's left Hogwarts for good, but Minerva insists that all students return for an Eighth Year if they wish to sit for NEWTs in the spring, and Harry needs those NEWTs to go into the Aurors. Draco's just grateful not to be in Azkaban. Or the Manor. He's hoping he can steer clear of Potter this year and grapple with his own problems. Unfortunately for him, Potter appears to be one of those problems. And that's not even addressing the fact that Potter's got serious issues of his own, which Draco realises as he's forced to share an Eighth Year dormitory room and several classes with the Gryffindor Git. If only they can make it through the year without killing each other, it should be all right, shouldn't it?",English,164523,1105,10312,3418,247479,True,10,10,2017-12-31
253,work_14380728,user-3861138,Love and Other Misfortunes,Mature,"Draco Malfoy is dying. He's part-Veela and needs his mate to survive. Post-war, Hermione Granger is a workaholic, up to her eyeballs in legal activism on behalf of Magical Beings, and hasn't yet noticed that Malfoy is the Magical Being who needs her most.",English,98584,867,10304,3153,300907,True,23,23,2018-06-07
254,work_6668308,user-194104,Higher and Higher (Temptation),Explicit,"Only Harry Potter could manage to put on a magical collar on impulse and find himself unable to take it off again. Now following Draco’s direct orders gives him intense pleasure, and Draco has a whole heap of troubles to deal with, not least the way Potter looks when the collar has him gasping with bliss. The whole situation would test the morals of a saint... and Draco’s no saint.",English,28482,438,10251,2364,174028,True,1,1,2016-04-26
255,work_9812738,user-2208139,I'll Write You An IOU,Teen And Up Audiences,"When Percival wakes up and sees a different ceiling than the dark, blood splattered one of his prison for the first time in three months, his first thought is, I’m going to owe Newt the biggest IOU ever.",English,7963,134,10215,2544,82350,True,1,1,2017-02-18
256,work_8981179,user-1280004,Her Beauty and the Moonlight,Explicit,When Harry helps Hermione find out the horrible truth - that Ron has been dosing her with love potions - she is furious. She is going to get her revenge on Ron in the most hurtful way she can think of – dating the one man he hates above all others.,English,37484,1451,10214,2149,219728,True,11,11,2017-05-05
257,work_610806,user-31607,The Great Christmas Biscuit Misunderstanding of 1977,Explicit,"In which Sirius just wants a bit of fun, James fancies himself awfully clever, Peter won't be brewing any potions, and Remus would rather not get shouted at by McGonagall again, thank you very much.",English,3231,68,10208,1165,108637,True,1,1,2012-12-27
258,work_10460622,user-148079,"Balance, Imperfect",Explicit,"When Harry sustains an injury in the line of work, he no longer knows how to navigate the life he loved, and finds help and solace from the most unexpected source.",English,91000,1343,10200,3115,199769,True,10,10,2017-04-24
259,work_23702959,user-5576086,That Universe Over There,General Audiences,"Finding himself in another universe, Harry makes the perfectly logical choice and adopts his younger self, destroys this world's leftover Voldie pieces, and tries his best to avoid happy goblins.",English,242424,2655,10197,3337,548149,False,58,,2021-12-16
260,work_33467971,user-106230,Dark Heritage,Not Rated,"Harry is removed from the Dursley family when he is eight years old, and enters the wizarding world a few years younger and a lot wiser. He discovers a surprising dark heritage, and develops goals that do not involve vanquishing a certain Dark Lord or becoming the Chosen One. Adopted into the Black family, Harry will fight against the expectation that he is to defeat the Dark Lord and instead dedicates himself to protecting the dark legacy that has been left to him. ",English,452495,3688,10190,3047,438745,False,69,,2022-11-19
261,work_28115205,user-4810216,The End Is The Beginning,Mature,"Death was not what Harry thought it would be. An empty train and a being proclaiming himself to be the Death, telling him that, “sorry, no afterlife for you” certainly wasn't anywhere near his expectations.",English,160802,1323,10189,2315,284084,True,33,33,2021-04-27
262,work_11980743,user-3402918,How Remus Got His Groove Back,Mature,After two years of noncommittal sex:,English,42766,929,10179,2779,159275,True,14,14,2017-10-29
263,work_5101361,user-752237,Timer,Teen And Up Audiences,"“If a clock could count down to the moment you meet your soul mate, would you want to know?” Of course, Harry had to miss the moment his clock ran out.  ",English,2105,216,10156,1061,107992,True,1,1,2015-10-29
264,work_9236771,user-1554475,Trouble,Explicit,"Now Draco’s cock is stirring, and he can’t breathe because all he can think of is screaming Harry’s name while Harry pins him down and mindlessly fucks him into total incoherency.",English,7018,550,10154,1636,152933,True,1,1,2017-01-07
265,work_26515429,user-223039,"You're Not A Horse, Harry!",Teen And Up Audiences,"
  “So you’re my dad,” Harry said to the large, blond one. The one with the hammer. Supposedly a god, even. 
",English,49524,1465,10146,3095,205634,False,37,,2022-08-23
266,work_19162495,user-4257326,Harry Potter gets smart and takes control - The Goblet,Teen And Up Audiences,"Harry's name comes out of the goblet and he's had enough, he's sick of pretending to be stupid, he's sick of constantly fighting against the whole world. It's time to step up and take control of his life.",English,465931,3499,10110,2967,501052,False,93,100,2021-12-20
267,work_4129527,user-81905,The Green Vial,Explicit,"After months of seeing Harry Potter walk into his Apothecary disappointed and hopeless, Draco offers to carry the baby that Harry can't. Now he's just got to hide the fact that he's been half in love with Harry for years.",English,31240,296,10110,1816,123878,True,1,1,2015-06-14
268,work_17707799,user-514371,Home is With You,Not Rated,"Harry decided for once to let fate have its way without a fight and was waiting to meet the soulmate that matches his soul mark in a normal, natural situation - and then one day, his soul mark changed. ",English,15738,309,10078,1655,145816,True,4,4,2019-04-20
269,work_29118777,user-5327645,Harry Potter And The- so I really am Fate's Bitch?,Mature,"Harry Potter was absolutely, unashamedly, done.First, Voldy uses a Ritual to bring his pasty snake ass back to life, killing Cedric- which, by the way, thanks for the extra trauma.Second, Harry goes through a lovely year of being tortured with a damn writing utensil and ends up in Azkaban after the Battle of the Department of Mysteries- which Dumbledore chose not to prevent.So, y'know, fuck him.",English,16901,486,10074,2725,239999,False,4,21,2022-11-07
270,work_13443876,user-817010,Crocodile Tears,Mature,"It was an accident! If it was anyone's fault, the blame landed on Hermione. He never expected to be transported back to 1943, two years before the fall of Grindelwald and when Tom Riddle was gaining his following. He certainly never meant to adopt a magical breed of crocodile, so much for living under the radar.",English,60432,2075,10066,3248,189642,False,21,,2021-01-28
271,work_23218696,user-4826572,Seeker Fit,Teen And Up Audiences,“Will the Head Girl grace the pitch with her presence for today’s match?” The timbre of Malfoy’s cool lilting drawl slid down Hermione’s spine.,English,2647,260,10062,1228,119655,True,2,2,2020-03-31
272,work_5021158,user-9,Love In Slow Motion,Explicit,Harry flushed. “I’d like to do that again.”,English,11481,127,10049,1360,117714,True,1,1,2015-10-18
273,work_9050257,user-8719,Basic Instincts,Explicit,“Who are you?” Graves demanded hoarsely. ,English,49482,898,10046,2560,159621,True,14,14,2017-01-14
274,work_439865,user-24903,Again and Again,Mature,"The Do-Over Fic - a chance to do things again, but this time-To Get it Right. But is it really such a blessing as it appears? A jaded, darker, bitter, and tired wizard who just wants to die; but can't. A chance to learn how to live, from the most unexpected source. Story is high on Political intrigue.  Dumbledore!bashing  slytherin!harry, dark!harry, eventual slash, lv/hp",English,334615,1617,10045,4340,419630,False,44,,2018-10-08
275,work_20551733,user-647319,A Big Black Sky,Mature,"Draco shifts his head as he turns to look at Scorpius, his cheek touching the pillow. ""Did you know that…"" He pauses, his throat convulsing, and it sounds audible in the silence, besides Michael's steady, even breathing from the other bedroom.",English,90247,1480,10006,3062,163843,True,13,13,2020-01-04
276,work_21154373,user-3259101,Good,Explicit,"He stood, buttoned his robes, and came around her desk to lean against the front. “Blaise told me you’re looking for something specific.”",English,39651,1353,9999,2979,369926,False,6,7,2022-10-24
277,work_1141722,user-18820,Safeguard,Teen And Up Audiences,The Chitauri invasion launches a whole new age - for everyone.,English,42402,1032,9955,3068,170076,False,5,,2015-12-24
278,work_4039174,user-1001960,The Name on Your Forehead,Mature,"The Weasley twin’s latest invention, a glitter-bomb that causes the name of your crush to appear across your forehead, wrecks havoc among the students of Hogwarts. As usual, Harry’s the one who bears the brunt of it.",English,10460,325,9942,1107,115476,True,4,4,2015-06-20
279,work_4177266,user-353431,The Consequences of A Binding Ritual,Explicit,"(This has been abandoned - sorry)Forced to be the fourth champion in the Triwizard Tournament and shunned by Hogwarts and the rest of  the Wizarding World, Harry finds comfort in the silence of the Chambers of Secrets.  Explorations of the Chambers turns up more rooms and information than he expected. One of which is a ritual that is called 'Slytherin Binding Ritual'.  Thinking it meant binding Salazar Slytherin's ghost to him and thinking 'meh, not like I'm gonna lose anything', Harry performs the ritual without even thinking of researching more about it.",English,171023,3487,9930,2671,331045,False,33,,2016-09-18
280,work_27736381,user-1785907,He Turned Around,Teen And Up Audiences,"When the Goblet of Fire spit out Harry's name that Halloween night, he was told to join the other champions. Instead, he turned around and walked away.",English,83384,1535,9925,3434,214787,False,24,,2022-09-08
281,work_1485385,user-381685,47 Days to Change (a translation),Explicit,"Harry Potter and Tom Riddle are enemies, born adversaries, prophesied leaders of opposite factions.",English,200888,2272,9918,1989,346580,True,97,97,2021-02-05
282,work_1113600,user-18820,Magnificent,Teen And Up Audiences,The birth of the Ministry of Magic and his relationship with the British Government.,English,19477,217,9917,2931,119931,True,1,1,2014-01-01
283,work_30758501,user-4588271,Heroes all have a Saving People Thing,Teen And Up Audiences,Aizawa gets called to England to deal with the Black family fortune and returns with a traumatized war hero cousin he will not be giving back. Aizawa's pretty sure his husband won't mind. ,English,94246,2434,9915,3301,258653,True,25,25,2022-01-22
284,work_484709,user-1628,Pinky Promises Are Powerful Magic,Teen And Up Audiences,Ickle Harry wants to stay with his newest hero.,English,12034,251,9900,1629,103830,True,1,1,2012-08-12
285,work_580386,user-92712,Legal Alien,Teen And Up Audiences,"Normal people didn't have to worry about this sort of thing when they go on a holiday. They worry about things like losing their luggage, catching a cab or something similar. Not alien invasions. Harry, however, had never been normal. Then again, neither were these guys. One-shot.",English,3150,84,9889,1411,80170,True,1,1,2012-06-14
