,work_id,user_id,title,rating,summary,language,words,comments,kudos,bookmarks,hits,completed,chapters_written,chapters_total,datetime_updated
724,work_9694178,user-2185121,violet hill,General Audiences,“It’s not that bad.” Hermione tries to amend.,English,28279,646,6339,2058,97425,False,3,,2017-04-26
725,work_9476138,user-700856,The Meaning of Dandelions,Teen And Up Audiences,"The stupid hat was stupid and refused to help Harry. The whole school and its division in houses was stupid too, and the teachers.Harry was in Hogwarts, but he didn't want to be. He wanted to go back home.",English,72013,1905,6338,489,88871,True,10,10,2017-03-11
726,work_315289,user-25964,Long Live Living (If Living Can Be This),Teen And Up Audiences,"It's the final summer before university, and Sirius has a sneaking suspicion he's missing something. A summer of pillow-forts, drinking & numerous re-watches of Dirty Dancing ensues. Non-magical AU set in Warwick Castle.",English,50848,611,6332,1907,171685,True,20,20,2012-03-07
727,work_2100033,user-397616,IN SICKNESS AND IN HEALTH.,Explicit,"At the end of Harry's 5th year he defeats Voldemort. After finding out that he has cancer and his friends turn their back on him, Harry runs away to Forks Washington.",English,114776,549,6331,1493,140912,True,15,15,2016-06-09
728,work_27651287,user-35202,Genius by the Numbers,Mature,"Harry Potter, as the eldest brother of the Girl-Who-Lived, has always felt like the average person in his family of geniuses. He has a plan that might change that, but meanwhile, he has to contend with his partially estranged family as he attends his sister’s wedding. And contend, too, with his sister’s fiancé, Tom Riddle.",English,44975,681,6329,1473,72065,True,7,7,2020-11-27
729,work_18648856,user-133639,Finding Home,Explicit,"Harry comes into a surprised creature inheritance on the night of his 16th birthday. With it comes hope, love, and more family than he ever expected. His creature status changes everything, and secrets start to be revealed. His view on who he is and who he can trust is altered, and his eyes are opened to the true meaning of the war. ",English,174992,1152,6323,1896,263137,False,29,,2022-11-17
730,work_996493,user-215966,Willing,Mature,"Harry's been missing since he was 9 years old, the wizarding world have been looking him for seven years. Since he was eleven years old and did not come to Hogwarts. He's Seventeen when they find him, but they are in for a shock if they think he'd do what they wanted. Turns out Harry has known Severus for years, he's a metamorphamagus. Dumbledore's manipulations are found out, the world is in for a shock. I want to show a caring side to Dom/Sub so there won't be a rough side to be seen here.",English,486471,1435,6323,1874,313989,True,120,120,2018-05-28
731,work_1037432,user-82516,Dead Man Walking,Teen And Up Audiences,"Kreacher goes back to save his master, and Regulus survives but his near-death-by-Inferi puts him into a coma for the next sixteen years. When he wakes, well, the world is not so different. Voldemort is still at large, and the Ministry is still inept. His brother’s got a godson now though, so it’s only natural for Regulus to keep an eye on young Harry as well.",English,57303,629,6322,2248,117389,False,4,,2016-07-07
732,work_7708432,user-93265,Dragon Singer,Mature,"When Charlie Weasley begins working at the Romanian reserve, he has no idea what a Dragon Singer is or how important the one that lives there will soon be to him.",English,51296,233,6319,1955,75734,True,13,13,2016-08-08
733,work_11972160,user-246310,Ligabus Filium,Explicit,"It should be careful, deliberate, but it isn't. Like every other part of their relationship, it happens gradually and then all at once, before they even realize it. And when the little blue threads bind them together, there's no going back.",English,41534,307,6305,1706,113753,True,12,12,2017-09-12
734,work_485605,user-64114,"There Be Dragons, Harry",Explicit,"Harem!Fic Harry inherits a creature ""thing"" from both sides of his parents and somehow that leads to weird sleeping habits, conversations with Theodore Nott and finding himself caught up in a world of Dragons, elemental powers and new creatures he's never heard of before. Dragons? Mates? Very AU. Contains all kinds of slash.",English,1100369,2105,6299,1974,416524,False,117,,2022-08-29
735,work_25073452,user-53377,Little Lion Boy,Not Rated,Draco is sorted into Gryffindor. ,English,11097,328,6296,1458,30073,True,1,1,2020-07-04
736,work_18177995,user-4794952,Lord Thanatos,Mature,"Hadrian Potter is sick of playing the Golden Boy, the Boy-Who-Lived, Albus Dumbledore's little Light pawn. After an unexpected creature inheritance he comes back to Hogwarts for his seventh year ready to enact vengeance on the people who betrayed him. Bringing his followers, mate and little Seer with him, Hadrian is ready to take the world by storm.",English,72819,791,6289,1717,156624,False,25,,2022-07-04
737,work_13200282,user-9,Harry Potter and the Truth of the Traitor,Not Rated,"It's Harry's third year at Hogwarts School of Witchcraft and Wizardry, and just like the last two, it promises to be anything but restful. House tensions are high, Harry's twin Jules, the darling of Gryffindor, doesn't like Harry any better than before, and on top of all that there's an escaped murderer on the loose who's apparently hell-bent on taking his revenge on both Potter twins.",English,106256,876,6283,493,121965,True,12,12,2018-03-06
738,work_18759055,user-4519314,A Smile like Sunshine,General Audiences,Sequel drabbles to A Hand like Sunshine.,English,2956,356,6282,673,52359,True,10,10,2020-01-24
739,work_4584735,user-601641,A Different Beginning,General Audiences,A very slight change in Harry's introduction to the magical world has unexpected consequences.,English,95806,422,6275,2180,91792,True,9,9,2015-08-23
740,work_14358219,user-3107673,Nestmother,Mature,"During the First Task, Harry realises she can understand the Horntail and instead of outflying her, tries to talk to her. And is promptly adopted. ",English,12420,502,6260,2123,74193,False,7,,2020-05-03
741,work_4223940,user-104018,It Takes a Village,Mature,"Author/Artist LJ Name: saras_girlSongspiration: Immortals - Fall Out BoyPrompter: ElectricKettleTitle: It Takes a VillagePrompt Number: 116Pairing(s): Harry/Draco and implied Ron/HermioneSummary: Eighth year isn’t exactly going to plan. Harry is definitely not running away, Draco is definitely not impressed, and it’s almost definitely not going to stop raining.Rating: NC17Disclaimer: All Harry Potter characters herein are the property of J.K. Rowling and Bloomsbury/Scholastic. No copyright infringement is intended.Warning: Original characters.Epilogue compliant? Hahaha... no.Word Count: 24,197Author's Notes: To my prompter – I hope you’ll forgive me for not addressing everything you wanted in this story. This was a pinch-hit for a pinch-hitter and I only had a few days to pull it together before the end of the fest. I couldn’t quite manage that ‘kick-ass’ feeling that you asked for, but I think I covered ‘us against the world’ as best I could. Crossing my fingers that you enjoy it anyway.(I have added ‘Big Hero 6’ to my to-watch list)",English,24190,305,6247,1454,83544,True,1,1,2015-06-28
742,work_20428298,user-153325,A Certain Mood,Teen And Up Audiences,"The moment the Goblet of Fire spat Harry's name out, it was second year all over again. Shunned by most of Hogwarts and made out to be an attention-seeking liar, he feels more isolated than ever.In the vacuum void of the heart-wrenching realisation that he'll never fit in, his new defense professor and that man's mysterious mentor manage to fill a hole in Harry's soul he hadn't known existed. And just like that, he finds himself... slipping.",English,190682,1622,6245,2064,181080,False,36,38,2022-06-20
743,work_34047913,user-8002765,Death's Chosen Child,Explicit,"When Harry's name comes out of the Goblet of Fire, he is livid. He didn't bloody want to join a deadly tournament, but it seems like no one believes him, so he swears a wizarding oath. ",English,120154,886,6244,1838,162062,True,13,13,2022-04-19
744,work_24102232,user-3296889,Crime and Punishment,Teen And Up Audiences,"Harry is accused of burglary. The Dursleys leave him to rot. Dumbledore sends Snape to remedy the situation. Harry finds himself in the care of an irate Snape. Not slash, gen-fic w/ focus on Sevitus relationship. Angst galore. Warnings: coarse and suggestive language, mentions of abuse/neglect. Un-betaed and un-Britpicked.",English,183992,1379,6242,2553,194715,False,27,,2022-11-18
745,work_2469854,user-104018,Catfished,Teen And Up Audiences,"Draco is in deep water, Harry can see straight through him, and that's not even the full scale of the problem.",English,32851,290,6241,1318,80512,True,1,1,2014-10-17
746,work_473335,user-60501,Twist of Fate,Teen And Up Audiences,"Draco asks Harry to help him beat the Imperius curse during 4th year. The lessons turn into more than either expected. A story of redemption and forgiveness. Pairings: HP/DM (Slash) Timeframe: 1994-2002 Goblet to 4 yrs post-DH EWE Rating T for language, high angst, content.",English,302014,991,6225,2398,303576,True,29,29,2012-08-09
747,work_9694457,user-2827883,Hot for Teacher,Mature,"Draco is a single dad trying to raise a teenager on his own. When he notices his son's newfound interest in girls, he takes it upon himself to give him some fatherly advice. Little does he know that his son's crush is none other than his own childhood nemesis, who has taken up the post of Defense Against the Dark Arts Professor at Hogwarts. Draco tries to juggle awkward situations, parenthood, and his own budding interest in Hermione Granger. COMPLETE!",English,61722,1712,6222,1823,206591,True,26,26,2017-05-03
748,work_478043,user-61654,Sowilo,Teen And Up Audiences,"Loki shelters from the rain in a coffee shop run by Harry Potter and somehow manages to change them both forever. - ""I've been calling you 'Mr Cappuccino' in my head all this time; you could have told me your name""-",English,7257,105,6217,1315,52332,True,2,2,2012-08-05
749,work_19707637,user-385768,The Venom Peddler,Teen And Up Audiences,"Curiosity killed the cat, satisfaction brought it back. Harry's curiosity leads him to exploring the Chamber a bit more thoroughly before he leaves for the Summer. What he finds there gives him a new responsibility beyond just himself and a lifelong satisfaction in the choices he makes from there on.",English,114011,1415,6216,2565,116017,True,56,56,2019-08-24
750,work_34923421,user-35202,The Answer is Silence,Mature,"Lord Voldemort might have been the first to know it, but others learned, including the Dursleys, the Hogwarts professors and students, and the Death Eaters: Harry Potter is terrifying.",English,40646,469,6211,1567,68797,True,7,7,2021-11-10
751,work_26055292,user-4144860,Speaking with Serpents,Teen And Up Audiences,"In which Harry would like nothing more than to become a world-renowned herpetologist, and he won't let a little thing like the existence of magic get in his way. If that means attending a school called Hogwarts—and really, how is he supposed to frame that on his college applications—then so be it.",English,85223,1979,6210,1969,116439,True,38,38,2021-12-25
752,work_11036913,user-197418,If stars died of old age,Not Rated,"His mother had had six months after his father had died. But it was expected; they had prepared and were already rather distanced. Draco hadn’t been ready, and Merlin, he had been so in love. He knew he was counting down in weeks, not months.",English,5115,214,6204,1206,56829,True,1,1,2017-06-02
753,work_991396,user-48507,"The Birds, The Bees, And The Snakes",Teen And Up Audiences,Harry discovers sexual education.,English,2557,96,6199,216,81390,True,1,1,2004-06-15
754,work_920957,user-192203,A Cure For Nightmares [+podfic],Explicit,"1976-1978: There's a mysterious new boy at St Godric's boarding school, and Sirius can't stop thinking about him, but the secret Remus is keeping might break Sirius's heart.",English,36083,315,6197,1442,131584,True,14,14,2014-05-19
755,work_19456585,user-35202,Conditionally,Teen And Up Audiences,Harry finds out that he's Snape's son. It goes as badly as possible.,English,39046,453,6195,1791,73930,True,6,6,2019-07-08
756,work_20391079,user-93732,Let's talk sugar,Teen And Up Audiences,In which Harry Potter may or may not be a sugar baby (jk he totally is),English,2258,69,6192,1044,41759,True,1,1,2019-08-25
757,work_1150239,user-9,Whore,Explicit,"The summer after his first year at Hogwarts, Harry returns to Privet Drive to learn his uncle has procured him a part time job. That news isn't half as shocking as what the actual job entails.",English,141676,992,6188,811,310137,True,49,49,2014-04-24
758,work_2791172,user-212722,The Little Marauders Nursery and Day Care,Explicit,"Harry Potter is the proud owner of The Little Marauders Nursery and Day Care and his favourite student is Scorpius Malfoy.  Scorpius's dad might be okay, too.",English,9835,157,6186,1009,70378,True,1,1,2014-12-21
759,work_13661709,user-3124812,Mine,Teen And Up Audiences,You are born with your soulmate's first words to you written in black on your palm. They fade to silver when you hear them. ,English,3800,173,6185,569,42092,True,1,1,2018-02-13
760,work_1094241,user-6004,On Call,Explicit,"For the rest of his life, Draco will blame what happened this Christmas on the fact that he hadn't thought to bring a book.",English,4271,66,6176,607,96867,True,1,1,2013-12-22
761,work_6535114,user-893045,Of Leaves and Stars,Teen And Up Audiences,"Almost a year out of Hogwarts, Lily finally manages to convince Sirius and James to get more acquainted with muggle technology and buy phones. Sirius, of course, texts the wrong number.",English,291430,4190,6166,1121,231580,False,68,,2021-12-25
762,work_3895723,user-6011,He Was He and I Was Bunny,Explicit,"The war is over and “eighth year” is about to begin at Hogwarts. But for Harry and Draco, nothing is quite the same. Harry’s looking for an escape, Draco’s looking for a friend. Does a little black bunny hold the answers for both of our boys?",English,37345,258,6162,1482,73949,True,4,4,2015-05-07
763,work_35714410,user-12868402,"Terrible, But Great",Mature,"“Harry Potter.” The cold burrowed into his flesh, the scent of cloying death and molding earth clogged his senses.",English,84123,2212,6159,1943,111097,False,15,,2022-08-02
764,work_13968495,user-1831813,Lollies and Loki,Teen And Up Audiences,Hermione Granger is seven years old when she kneels in front of an altar she's made herself with an offering of the best sweets her pocket money could buy and prays to a Trickster God.,English,180008,1951,6159,1655,141643,True,49,49,2019-12-11
765,work_8551657,user-1038966,Praeclarus Anguis,Mature,"“Tell me Harry, if I were to tell you that you could go back in time and prevent one event of your choice from ever occurring would you do so?”Go back in time? A chance to change the past for a better future? “If such were possible, Sir, I think it’s safe to say most people would.”“Would you be an exception?” Harry shook his head. “What would you change?”His immediate knee jerk reaction was that he’d go back to that horrible night in Godrick’s Hollow and prevent the murder of his parents, but when he opened his mouth to speak he stopped abruptly. The Head Master was staring at him from behind his half-moon glasses in a way that made him think that this question was in itself a sort of test. And with more examination the prospect seemed a bit selfish.At once Harry knew what he would do. “I would stop Tom Riddle from ever becoming Voldemort.”",English,171641,741,6147,1471,260771,True,45,45,2017-01-19
766,work_11050104,user-1525786,You Can't Take the Sky From Me,Teen And Up Audiences,"Oleander Evans, also known as Skull de Mort, had no idea that visiting his sister Petunia was going to fuck up his life.",English,40327,546,6139,2397,125941,False,19,,2018-01-02
767,work_6832255,user-18623,Harry Potter and the Avatar's Return,General Audiences,"After finding a torn comic in the trash when told to clean Dudley’s room, four year old Harry Potter puts it together with some odd things that have happened around him, and concludes that he’s the Avatar. ",English,9147,402,6134,1468,54722,True,1,1,2016-05-12
768,work_2704532,user-437078,Our Own Demons,Teen And Up Audiences,Tony Stark. Genius. Billionaire. Philanthropist. Ironman. (Reckless. Lonely. Father.),English,124702,1543,6122,2433,210924,False,25,,2021-09-19
769,work_3907327,user-123135,There All the Honour Lies,General Audiences,"Harry lets all of Asgard know what he thinks of their views on honour, war and magic.",English,1125,94,6119,870,57231,True,1,1,2015-05-09
770,work_3969321,user-191264,Endowment,Explicit,"
  Potter has got under my skin for far too long, in far too many ways. I fully intend to return the favour. 
",English,10834,278,6114,1119,168331,True,1,1,2015-05-19
771,work_14493711,user-3186048,Antlers and Ivy,Explicit,"The thing is, Draco has always known he wouldn’t be able to marry his soulmate. Finding out his soulmate is Harry Potter shouldn’t change anything.",English,19124,298,6112,1054,66888,True,6,6,2018-04-30
772,work_30789119,user-19986,A Perfect Fit,Explicit,Harry has had to live his life with the curse of being overly well-endowed.,English,17993,104,6111,1547,103557,True,1,1,2021-04-20
773,work_33168859,user-10035666,disintegration,Explicit,"Remus stepped into Sirius’ personal space, leaning down and taking out his holy water doused dagger from his pouch. He placed it flat underneath Sirius’ chin, pushing his head up to look him in the eyes. He hissed as the silver burnt him, red and vicious.",English,484533,2226,6104,2184,362718,False,27,,2022-10-23
774,work_3942424,user-803708,Stranger in a Familiar Land,Explicit,"Tony Stark is a complicated guy with secrets. Despite riches and fame, he has few true friends and little life outside of Iron Man. Which is what everyone seems to want, except Pepper. Pepper hates Iron Man, but he can't change what he is.Harry Potter has no idea what life after death holds, but he can't go back, can't undo what has been done. A new life, new people, and a new world. The only direction is forward, for both of them.",English,224876,1007,6098,2240,184627,False,22,,2019-09-15
775,work_11912106,user-1221814,The Difference,Not Rated,"This is like all the WBWL, abandoned Harry, but with a twist.",English,42543,1381,6097,1374,167560,False,21,,2022-11-08
776,work_9838181,user-397616,Their Beloved Prince,Explicit,"8 year old Harry Potter is found dying by the Volturi. Taking a chance, Aro decides to turn him and raise him with the help of his brothers. Will Harry turn out to be like all the other immortal children, or will he turn out to be something more?",English,111570,1194,6096,1574,140925,False,22,,2021-12-29
777,work_12523392,user-3157101,Harry Potter's Temper,General Audiences,"Few things are scarier than an angry mother...Loki had seen each of his children ripped away at birth for a crime they hadyet to commit by his own father. Looking down at his newest child, HarryPotter, he vowed that would never happen.If he has to take over midgard to have a place where he can openly lovehis children, so be it.One thing scarier than an angry mother is a MoD's protecting their mother...Years later Loki's youngest son Harry Potter, the-boy-who-lived, Master ofDeath, etc... has had enough of people walking all over his mother.",English,3348,142,6095,1019,66209,True,2,2,2019-01-31
778,work_4902346,user-7388,The Way Down,Teen And Up Audiences,"Harry is overwhelmed by his own power and fame and angst, so he's become a hermit.  Draco Malfoy is tired of the melodrama.",English,65615,406,6088,1696,113487,True,9,9,2012-04-12
779,work_463038,user-48744,"In Time, Once Again",Explicit,"After the Battle of Hogwarts, Harry uses a Time Turner in an attempt to rewrite history.  However, something goes wrong, and he’s thrown back fourteen years into the past.",English,29565,218,6087,1190,134488,True,1,1,2012-07-18
780,work_15068012,user-2589058,The Child of Azkaban,Teen And Up Audiences,"Being in the middle of a dangerous war meant having to plan ahead for the worst case scenario, as both James and Lily Potter very well knew. And as such, they placed powerful safeguards to ensure their son Harry would grow up with proper guardians should anything happen to them.",English,99356,772,6080,1369,142187,True,20,20,2018-12-30
781,work_1097794,user-243647,The Syntax of Things,Mature,"A short-lived series of private lessons took place after Christmas in Harry Potter's fifth school year, during which Severus Snape attempted to teach Harry the skill of Occlumency. The lessons were ultimately cancelled when Harry was caught prying into Snape's memories, discovering the strangest things: A mysterious prophecy connected Harry's fate with Voldemort's, Harry's dad was an insufferable bully, and Severus Snape had been in love with Harry's mum. Naturally, Harry now has a million questions. Snape would prefer to answer none.",English,200436,3315,6072,1228,496233,True,72,72,2021-07-29
782,work_90292,user-601,The Politician's Wife,Mature,"This story is set twenty-three years after the fall of Voldemort. Our main characters are Ministry employees, middle-aged, and the majority of them not very happy.",English,65893,1029,6048,2290,170619,True,14,14,2010-05-28
783,work_31799176,user-72494,unexpected,Explicit,"Hand drifting down to her abdomen, she knew. When she was younger, she’d known that there was something different about her. About her abilities. Her certainty had been palpable, and was only confirmed when Professor McGonagall had shown up on her doorstep with that fateful letter in hand. And now, just over ten years later, she felt that same sense of certainty again.She was pregnant. ",English,66880,624,6045,1531,142976,True,13,13,2021-09-09
784,work_364698,user-6004,"Ferocious Determination, Insufficient Deliberation, and a Slightly Wrong Destination",Explicit,"All Draco wants is sleep, but his bed won't stop talking. More importantly, it refuses to stop looking like Harry Potter.",English,9567,66,6045,1067,83214,True,1,1,2012-03-18
785,work_21851152,user-83106,Shatter,Mature,"1993. Harry Potter is imprisoned at age 12 for life for the murder of Ginerva Weasley. He's innocent, but left the diary behind. His next-door cellmate is Sirius Black. Four years later... Voldemort arrives.Harry senses an opportunity. A prophecy shatters.Dumbledore and his precious Order had better watch out.",English,61473,922,6037,1787,162782,False,24,,2021-05-19
786,work_1369690,user-177599,The Triumph of These Tired Eyes,Teen And Up Audiences,"In the several millennia he had existed Loki Odinson, Norse God of Mischief and Lies, had been many things, he had been a liar, a warrior, and a trickster, just to name a few, but never before, in his thousands of years of existence had he been a loving father, but all it took was a single glance at the perfect little creature before him and he knew, he was gone.",English,324570,909,6036,2219,158114,True,33,33,2016-11-01
787,work_13513191,user-3342216,Puppy Breath and Money,Explicit,Harry Potter had spent the last three years terrified for Draco Malfoy.,English,18802,170,6034,1025,85011,True,4,4,2018-01-30
788,work_1647644,user-18820,Tumbling HP Crossovers,Mature,"Crossover snippets done to prompts from Tumblr. Harry Potter centric. Slash, crack, au, etc.",English,37669,801,6032,855,122198,False,27,,2021-10-14
789,work_22405891,user-6643837,The Immortal and the Revenant,Not Rated,"As usual, Merlin has utterly failed in keeping a low profile by inadvertently getting himself dragged into a mess of a situation that appears to have something to do with a seemingly unkillable snake man, a toad woman, an order of phoenixes, and a boy named Harry Potter who, he quickly finds, is equally bemused by his current predicament. When he discovers how lost the boy is, he resolves to help him and his friends get rid of this dark lord--as well as their malignant (and worse, ineffectual) new teacher.",English,153326,2310,6028,1871,124926,True,43,43,2020-04-18
790,work_23046370,user-4551509,Stark Realisation,Mature,Harry had no idea that a one-night stand would lead to something more. Tony had no idea what he was walking into when he focused his attention on a man that he knew was trouble. Starts pre-Ironman and Post Hogwarts.,English,35680,283,6023,1629,99534,True,15,15,2020-09-19
791,work_376913,user-158,Angels and Devils (re-edit Jul 2019),Explicit,"Harry defeated Voldemort and his act of heroism is famous throughout the wizarding world. He's trying to finish his final year at Hogwarts in peace, but, thanks to the method he chose to destroy The Dark Lord,  something peculiar is happening to him, something he never would have expected. It's all rather embarrassing and making his life very complicated.",English,52054,146,6023,1174,118449,True,10,10,2005-01-12
792,work_22073215,user-4637810,Awakening,Mature,"After his name came out of the Goblet of Fire, Harry woke to a disturbing reality. The wizarding world only saw him as an expendable pawn, his carefree attitude towards studying left him struggling to survive, and he had never truly appreciated the one, constant companion at his side—Hermione Granger. It was high time for change. Gradual Grey!HHR.",English,54827,1727,6020,2087,150282,True,13,13,2020-10-14
793,work_20931752,user-31788,Roads Untaken,Teen And Up Audiences,Harry wanted to be outraged on behalf of the castle that he still considered to be his home. Hogwarts didn't deserve to have a piece of Tom Riddle lodged inside it like a particularly vicious splinter. ,English,3008,106,6020,1022,30930,True,1,1,2019-10-07
